{
  "basic_info": {
    "url_slug": "/games/grandia-iii",
    "title": "Grandia III",
    "cover_url": "/images/grandia-iii.jpg",
    "genres": [
      "JRPG",
      "Adventure"
    ],
    "themes": [
      "Classic"
    ],
    "modes": {
      "single_player": true,
      "multiplayer_local": false,
      "multiplayer_online": false,
      "co_op": false
    },
    "difficulty_rating": 3,
    "developers": [
      "Game Arts"
    ],
    "publishers": [
      "Square Enix"
    ],
    "reception_score": 6.4,
    "review": "Grandia III offers a beautiful open world and a charming story, but its combat system feels clunky and repetitive compared to modern JRPG standards."
  },
  "release": {
    "alternative_names": [
      "Gurandia Surī",
      "Grandia 3"
    ],
    "platforms": [
      {
        "name": "PlayStation 2",
        "region": "Japan",
        "release_date": "2005-08-04"
      },
      {
        "name": "PlayStation 2",
        "region": "North America",
        "release_date": "2005-12-14"
      },
      {
        "name": "PlayStation 2",
        "region": "Europe",
        "release_date": "2006-03-24"
      }
    ]
  },
  "serie": {
    "is_part_of_serie": true,
    "serie_name": "Grandia",
    "part_number": 3,
    "previous_game": {
      "title": "Grandia II",
      "url_slug": "/games/grandia-ii"
    }
  },
  "similar_games": [
    {
      "title": "Tales of Symphonia",
      "url_slug": "/games/tales-of-symphonia"
    },
    {
      "title": "Final Fantasy X",
      "url_slug": "/games/final-fantasy-x"
    },
    {
      "title": "Star Ocean: The Second Story",
      "url_slug": "/games/star-ocean-the-second-story"
    },
    {
      "title": "Valkyrie Profile",
      "url_slug": "/games/valkyrie-profile"
    }
  ],
  "play_today": [
    {
      "platform": "PlayStation 2",
      "details": "The North American PS2 version is the definitive choice for Grandia III. It is the only version with official English localization, making it playable for English speakers without needing fan translations. While the game suffers from a notorious bug regarding the 'Holy' spell requiring maxed elements, this is easily fixed via save states on emulators. The game features the complete story and combat system intended by the developers, offering a unique turn-based experience distinct from the series' other entries.",
      "available_in_english": {
        "official_localization": true
      },
      "recommended_patches": [
        {
          "name": "Grandia III Holy Spell Fix (Save State Workaround)",
          "description": "A documented workaround for the PlayStation 2 version's notorious bug where the 'Holy' spell fails to function unless specific elements are maxed out; requires using emulator save states to bypass the late-game softlock.",
          "url": "https://wiki.pcsx2.net/index.php/Grandia_III"
        },
        {
          "name": "Grandia III Widescreen and High-Resolution Patch",
          "description": "A community-created patch for the PlayStation 2 version that enables widescreen aspect ratios and higher internal resolutions when played on modern PCSX2 emulator builds.",
          "url": "https://www.romhacking.net/hacks/5678/"
        }
      ],
      "emulators": [
        {
          "platform": "Windows",
          "recommended_emulator": "PCSX2",
          "optimal_settings": [
            "Enable Save States to bypass the Holy Spell bug",
            "Set Internal Resolution to 2x or 3x Native for sharper visuals",
            "Enable Anisotropic Filtering for texture clarity",
            "Use 'Hardware' renderer with 'Fast' speed hacks disabled for stability"
          ]
        },
        {
          "platform": "Android",
          "recommended_emulator": "NetherSX2",
          "optimal_settings": [
            "Enable Save States for bug workarounds",
            "Set Resolution to 2x Native for balanced performance",
            "Enable Texture Filtering for smoother scaling",
            "Configure controller mapping for optimal touch controls"
          ]
        }
      ]
    },
    {
      "platform": "PlayStation 3 (PSN Classic)",
      "details": "Digital re-release on PlayStation Store as a PS2 Classic. Same content as original but with convenient digital access and trophy support.",
      "available_in_english": {
        "official_localization": true,
        "fan_translation": false
      },
      "retro_achievements_support": true,
      "recommended_patches": [],
      "emulators": []
    }
  ],
  "description": {
    "synopsis": "Grandia III follows Yuki, a young boy with a passion for building airplanes, who leaves his village to explore the world. He is joined by a diverse group of companions, including a mysterious girl named Lilia and a skilled pilot named Rude. Together, they must stop the evil organization 'The Order' from using the power of the 'Grandia' to destroy the world.",
    "key_features": [
      "Free-roaming open world exploration without loading screens",
      "Real-time combat system with active movement and dodging",
      "Customizable airship 'Grandia' for travel and combat",
      "Character-specific skill trees and weapon mastery",
      "Dynamic weather and day-night cycle affecting gameplay",
      "Non-linear quest structure with optional side stories",
      "Party-based tactical combat with positioning mechanics",
      "Extensive crafting and item synthesis systems"
    ],
    "long_description": "No description available.",
    "legacy_and_impact": [
      "Grandia III is remembered as a polarizing entry in the series, praised for its ambitious open-world design on the PS2 but criticized for its dated combat mechanics. It remains a cult favorite among fans of the Grandia series for its unique aviation theme and nostalgic value."
    ]
  }
}