{
  "basic_info": {
    "url_slug": "/games/bravely-default-ii",
    "title": "Bravely Default II",
    "cover_url": "/images/bravely-default-ii.jpg",
    "genres": [
      "Adventure"
    ],
    "themes": [
      "Classic"
    ],
    "modes": {
      "single_player": true,
      "multiplayer_local": false,
      "multiplayer_online": false,
      "co_op": false
    },
    "difficulty_rating": 3,
    "developers": [
      "Claytechworks"
    ],
    "publishers": [
      "Square Enix"
    ],
    "reception_score": 1,
    "review": "IGN praised the game's deep job system and strategic combat but noted the story felt generic compared to the original."
  },
  "release": {
    "alternative_names": [
      "Bravely Default 2",
      "BDII"
    ],
    "platforms": [
      {
        "name": "Nintendo Switch",
        "region": "World",
        "release_date": "2021-02-26"
      },
      {
        "name": "Windows",
        "region": "World",
        "release_date": "2021-09-02"
      }
    ]
  },
  "serie": {
    "is_part_of_serie": true,
    "serie_name": "Bravely",
    "part_number": 3,
    "previous_game": {
      "title": "Bravely Second: End Layer",
      "url_slug": "/games/bravely-second-end-layer"
    }
  },
  "similar_games": [
    {
      "title": "Bravely Default: Flying Fairy",
      "url_slug": "/games/bravely-default-flying-fairy"
    },
    {
      "title": "Bravely Second: End Layer",
      "url_slug": "/games/bravely-second-end-layer"
    },
    {
      "title": "Final Fantasy Tactics",
      "url_slug": "/games/final-fantasy-tactics"
    },
    {
      "title": "Octopath Traveler",
      "url_slug": "/games/octopath-traveler"
    },
    {
      "title": "Persona 5 Royal",
      "url_slug": "/games/persona-5-royal"
    },
    {
      "title": "Dragon Quest XI S",
      "url_slug": "/games/dragon-quest-xi-s"
    },
    {
      "title": "Tactics Ogre: Let Us Cling Together",
      "url_slug": "/games/tactics-ogre-let-us-cling-together"
    }
  ],
  "play_today": [
    {
      "platform": "Windows (Steam)",
      "details": "The definitive version with superior performance, up to 120FPS support, 4K resolution options, and enhanced graphical settings. PCGamingWiki confirms full Steam Deck compatibility with cloud save support.",
      "available_in_english": {
        "official_localization": true,
        "fan_translation": false
      },
      "retro_achievements_support": true,
      "recommended_patches": [
        {
          "name": "Ultrawide Fix Mod",
          "description": "DLL hook that adds ultrawide/custom resolution support with centered 16:9 HUD. Available via GitHub and GameBrew.",
          "url": "https://github.com/Lyall/BravelyDefault2Fix"
        },
        {
          "name": "60 FPS Mod",
          "description": "Community mod that enables higher frame rates beyond the default 30FPS cap for smoother gameplay on capable hardware.",
          "url": "https://gbatemp.net/threads/bravely-default-ii-60-fps-mod.583819/"
        },
        {
          "name": "ReShade Preset",
          "description": "Enhances visual quality with improved lighting, colors, and sharpness for a more polished appearance.",
          "url": "https://www.reshade.me/"
        }
      ],
      "emulators": []
    },
    {
      "platform": "Nintendo Switch",
      "details": "This entry represents the Switch version as a fallback for users who strictly prefer console ecosystems over PC. While identical in content to the first Switch entry, it is ranked lower due to the technical constraints mentioned previously. It serves as a viable option for those who own a Switch but lack a gaming PC, offering the same narrative and gameplay loop.",
      "available_in_english": {
        "official_localization": true
      },
      "recommended_patches": [
        {
          "name": "Bravely Default II 60 FPS Mod (Switch)",
          "description": "A homebrew patch for the Switch version that unlocks the frame rate to 60 FPS and improves rendering performance, requiring a modded console to install.",
          "url": "https://www.gamebrew.org/wiki/Bravely_Default_II_60_FPS_Mod_Switch"
        },
        {
          "name": "Bravely Default II 60 FPS Mod (GBAtemp)",
          "description": "An alternative version of the 60 FPS patch discussed in the GBAtemp community, offering improved stability and visual clarity for handheld mode.",
          "url": "https://gbatemp.net/threads/bravely-default-ii-60-fps-mod.583819/page-2"
        },
        {
          "name": "60 FPS Mod Switch",
          "description": "Community mod that changes target FPS to 60. Higher GPU overclock recommended for better resolution.",
          "url": "https://www.gamebrew.org/wiki/Bravely_Default_II_60_FPS_Mod_Switch"
        },
        {
          "name": "System Update",
          "description": "Official Nintendo system update to ensure optimal performance and bug fixes.",
          "url": "https://www.nintendo.com/au/games/nintendo-switch/bravely-default-ii"
        }
      ],
      "emulators": []
    },
    {
      "platform": "Nintendo Switch 2 (via Backward Compatibility)",
      "details": "Runs via backward compatibility with improved frame stability compared to original Switch, though no native version exists yet. Performance issues reported by some users including skipping and frame loss.",
      "available_in_english": {
        "official_localization": true,
        "fan_translation": false
      },
      "retro_achievements_support": false,
      "recommended_patches": [
        {
          "name": "60 FPS Mod Switch",
          "description": "Community mod that changes target FPS to 60. Higher GPU overclock recommended for better resolution.",
          "url": "https://www.gamebrew.org/wiki/Bravely_Default_II_60_FPS_Mod_Switch"
        }
      ],
      "emulators": []
    },
    {
      "platform": "Windows",
      "details": "The definitive modern experience for Bravely Default II. The PC version offers native widescreen support, unlocked frame rates, and Steam cloud saves. It includes all DLC content and allows for controller remapping. While the Switch version is portable, the PC port provides superior visual fidelity and performance stability without the 3-hour save limit found on the console.",
      "available_in_english": {
        "official_localization": true
      },
      "recommended_patches": [
        {
          "name": "BravelyDefault2Fix",
          "description": "An ASI plugin that enables ultrawide and custom resolution support, unlocks the in-game console for debugging, and fixes various graphical glitches on PC.",
          "url": "https://github.com/Lyall/BravelyDefault2Fix/releases"
        },
        {
          "name": "Bravely Default II 60 FPS Mod",
          "description": "A community-created mod that unlocks the frame rate cap to 60 FPS, significantly improving combat fluidity and reducing input lag compared to the default 30 FPS lock.",
          "url": "https://www.nexusmods.com/bravelydefault2/mods/23"
        },
        {
          "name": "Battle UI Frame Mod",
          "description": "Replaces the modern battle UI with a frame style reminiscent of the original 3DS Bravely Default games, improving readability and aesthetic consistency for series veterans.",
          "url": "https://www.nexusmods.com/bravelydefault2/mods/top"
        }
      ],
      "emulators": []
    }
  ],
  "description": {
    "synopsis": "Bravely Default II is a turn-based role-playing game set in the world of Luxendarc, where four new Heroes of Light must stop the evil sorcerer Zoldaad from plunging the world into eternal darkness. Players utilize the signature Brave and Default system to manage turn economy, switching between classes to adapt to various combat scenarios while unraveling a mystery involving the cycle of time and the true nature of the world's magic.",
    "key_features": [
      "Brave and Default Command System allowing players to stock turns for powerful multi-turn attacks",
      "Class-based Job System with over 20 unique classes including Knight, Thief, and Summoner",
      "Job Fusion mechanic allowing the combination of two classes to create hybrid abilities",
      "Turn-based tactical combat with real-time movement and positioning on a grid",
      "Extensive character customization through equipment, accessories, and skill trees",
      "Dynamic battle music that changes tempo and intensity based on combat status",
      "Open-world exploration with fast-travel points and hidden dungeons",
      "Post-game New Game+ mode with increased difficulty and exclusive rewards",
      "Co-op multiplayer support for specific dungeon challenges",
      "High-fidelity 3D graphics with a distinct anime-inspired art style"
    ],
    "long_description": "No description available.",
    "legacy_and_impact": [
      "Bravely Default II solidified the series' reputation for deep, strategic turn-based combat on modern platforms. While it did not achieve the critical acclaim of its predecessor, it expanded the franchise's reach to PC and Switch audiences, ensuring the survival of the unique Brave/Default mechanic in the modern RPG landscape."
    ]
  }
}