{
    "basic_info": {
        "url_slug": "/games/xenoblade-chronicles-x",
        "title": "Xenoblade Chronicles X",
        "cover_url": "/images/xenoblade-chronicles-x.jpg",
        "genres": [
            "RPG",
            "JRPG"
        ],
        "themes": [
            "Survival and Exploration",
            "Humanity vs Aliens",
            "Discovery",
            "World Building",
            "Science Fiction"
        ],
        "modes": {
            "single_player": true,
            "multiplayer_local": false,
            "multiplayer_online": true,
            "co_op": true
        },
        "difficulty_rating": 4,
        "reception_score": 8.7,
        "review": "Xenoblade Chronicles X is a unique sci-fi JRPG praised for its massive open world exploration, innovative Skell mecha combat system, and single-player MMO-like experience on the planet Mira.",
        "developers": [
            "Monolith Soft"
        ],
        "publishers": [
            "Nintendo"
        ]
    },
    "release": {
        "alternative_names": [
            "XCX",
            "Xenoblade Chronicles X: Definitive Edition",
            "XBCXDE"
        ],
        "platforms": [
            {
                "name": "Wii U",
                "region": "Japan",
                "release_date": "2015-04-29"
            },
            {
                "name": "Wii U",
                "region": "North America",
                "release_date": "2015-12-04"
            },
            {
                "name": "Wii U",
                "region": "Europe",
                "release_date": "2015-12-04"
            },
            {
                "name": "Wii U",
                "region": "Australia",
                "release_date": "2015-12-05"
            },
            {
                "name": "Nintendo Switch",
                "region": "World",
                "release_date": "2025-03-20"
            }
        ]
    },
    "serie": {
        "is_part_of_serie": true,
        "serie_name": "Xenoblade Chronicles",
        "part_number": 4,
        "previous_game": {
            "title": "Xenoblade Chronicles 2",
            "url_slug": "/games/xenoblade-chronicles-2"
        },
        "next_game": null
    },
    "similar_games": [
        {
            "title": "Mass Effect Andromeda",
            "url_slug": "/games/mass-effect-andromeda"
        },
        {
            "title": "Horizon Zero Dawn",
            "url_slug": "/games/horizon-zero-dawn"
        },
        {
            "title": "The Legend of Zelda: Breath of the Wild",
            "url_slug": "/games/zelda-breath-of-the-wild"
        },
        {
            "title": "Starfield",
            "url_slug": "/games/starfield"
        },
        {
            "title": "Xenoblade Chronicles 3",
            "url_slug": "/games/xenoblade-chronicles-3"
        }
    ],
    "play_today": [
        {
            "platform": "Nintendo Switch (Definitive Edition)",
            "details": "The definitive version with enhanced visuals, improved character models, smoother performance, quality-of-life improvements including shared XP and quest tracking, plus new epilogue content. Best played on docked mode for optimal visuals.",
            "available_in_english": {
                "official_localization": true,
                "fan_translation": false
            },
            "retro_achievements_support": true,
            "recommended_patches": [
                {
                    "name": "Cut Content Restoration Mod",
                    "description": "Restores dozens of unused missions, weapons, arts, and Skells that were cut from the original release. Version 1.0 is the latest stable release.",
                    "url": "https://gamebanana.com/mods/607445"
                },
                {
                    "name": "Alternate Button Prompts",
                    "description": "Support for Dualshock 4, Dualsense, and Xbox One controller button prompts instead of default Switch buttons.",
                    "url": "https://gamebanana.com/mods/651545"
                }
            ],
            "emulators": [
                {
                    "platform": "Windows",
                    "recommended_emulator": "Eden",
                    "optimal_settings": [
                        "Resolution scale: 2x for 1080p output",
                        "Enable VSync for stable frame rate",
                        "Use latest graphics drivers"
                    ]
                },
                {
                    "platform": "Android",
                    "recommended_emulator": "Eden",
                    "optimal_settings": [
                        "Custom button mapping",
                        "Save state slots enabled",
                        "Performance mode for stable 30fps"
                    ]
                }
            ]
        },
        {
            "platform": "Wii U (Original)",
            "details": "The original release with classic presentation. Requires physical disc or emulator to play. Lacks Definitive Edition improvements.",
            "available_in_english": {
                "official_localization": true,
                "fan_translation": false
            },
            "retro_achievements_support": false,
            "recommended_patches": [],
            "emulators": [
                {
                    "platform": "Windows",
                    "recommended_emulator": "Cemu",
                    "optimal_settings": [
                        "Internal resolution: 2x or higher for HD output",
                        "Enable Widescreen hack if desired",
                        "Low-latency audio settings"
                    ]
                },
                {
                    "platform": "Android",
                    "recommended_emulator": "Cemu Android (if available)",
                    "optimal_settings": [
                        "Custom button mapping",
                        "Save state slots enabled",
                        "Performance mode for stable 30fps"
                    ]
                }
            ]
        }
    ],
    "description": {
        "synopsis": "In the year 2054, Earth has been destroyed by an intergalactic war between two alien races. A small number of survivors aboard the USS White Whale crash land on the mysterious planet Mira, where they must rebuild humanity while exploring a vast untamed world and battling hostile alien creatures.",
        "key_features": [
            "Massive open-world exploration with single-player MMO-like experience",
            "Innovative Skell mecha combat system for traversal and battle",
            "Character customization including appearance, voice, and gender",
            "Extensive side quests and survey missions across diverse biomes",
            "Online co-op multiplayer support for certain activities"
        ],
        "long_description": "Xenoblade Chronicles X, developed by Monolith Soft and published by Nintendo, was originally released on Wii U in Japan (April 29, 2015) and later internationally (December 2015). It is the fourth main installment in the Xenoblade Chronicles series and a spiritual successor to the original game. Set in the year 2054 after Earth's destruction by an intergalactic war between alien races called the Gaur and Vahnatai, players control one of four customizable protagonists who crash land on the mysterious planet Mira aboard the USS White Whale. The game features a massive open world with single-player MMO-like elements, innovative Skell mecha combat for both traversal and battle, extensive character customization including appearance, voice, and gender selection, and over 100 hours of content through main story missions and side quests. The Definitive Edition (March 20, 2025) brings the game to Nintendo Switch with enhanced visuals, improved character models, smoother performance, quality-of-life improvements including shared XP and quest tracking, plus new epilogue content.",
        "legacy_and_impact": [
            "Considered one of the most ambitious open-world JRPGs ever created",
            "Pioneered single-player MMO-like experience in console RPGs",
            "Established Skell mecha system as unique gameplay mechanic",
            "Definitive Edition achieved 87 Metacritic score, among highest-rated Switch games of 2025",
            "Demonstrated Nintendo's commitment to bringing Wii U exclusives to modern platforms"
        ]
    }
}